{
  "type": "playbook",
  "spec_version": "cacao-2.0",
  "id": "playbook--aaaaaaaa-aaaa-4aaa-8aaa-aaaaaaaaaaaa",
  "name": "Vulnerability intake (parser fixture)",
  "description": "CACAO playbook used by the shared parser tests. Triages an incoming vulnerability advisory, branches on critical severity, then opens a remediation ticket. Authoring of the canonical vuln_intake playbook under content/ is tracked on a separate card; this copy is a parser fixture only.",
  "playbook_types": ["investigation", "remediation"],
  "created_by": "identity--bbbbbbbb-bbbb-4bbb-8bbb-bbbbbbbbbbbb",
  "created": "2026-05-27T00:00:00Z",
  "modified": "2026-05-27T00:00:00Z",
  "labels": ["vulnerability-management", "intake"],
  "playbook_variables": {
    "__finding_id__": {
      "type": "string",
      "description": "Vendor advisory or scanner finding identifier.",
      "external": true
    },
    "__severity__": {
      "type": "string",
      "description": "Normalised severity (CVSS-derived) — one of low, medium, high, critical.",
      "external": true
    }
  },
  "workflow_start": "start--11111111-1111-4111-8111-111111111111",
  "workflow": {
    "start--11111111-1111-4111-8111-111111111111": {
      "type": "start",
      "name": "intake-start",
      "on_completion": "action--22222222-2222-4222-8222-222222222222"
    },
    "action--22222222-2222-4222-8222-222222222222": {
      "type": "action",
      "name": "enrich finding",
      "description": "Pull asset, owner, and exposure context for the finding.",
      "on_completion": "if-condition--33333333-3333-4333-8333-333333333333",
      "in_args": ["__finding_id__"],
      "out_args": ["__severity__"],
      "x_secops_ng": {
        "detection_refs": ["detection.sigma.vuln.cve_advisory_seen@v1"],
        "telemetry_refs": ["telemetry.ocsf.vulnerability_finding@v1"]
      }
    },
    "if-condition--33333333-3333-4333-8333-333333333333": {
      "type": "if-condition",
      "name": "critical severity?",
      "on_success": "action--44444444-4444-4444-8444-444444444444",
      "on_failure": "action--55555555-5555-4555-8555-555555555555"
    },
    "action--44444444-4444-4444-8444-444444444444": {
      "type": "action",
      "name": "open critical ticket",
      "description": "Open a P1 ticket with the asset owner and link the advisory.",
      "on_completion": "end--66666666-6666-4666-8666-666666666666",
      "x_secops_ng": {
        "control_refs": ["control.nis2.art21.risk_management@v1"],
        "metric_refs": ["metric.mttr.vuln_critical@v1"]
      }
    },
    "action--55555555-5555-4555-8555-555555555555": {
      "type": "action",
      "name": "queue routine ticket",
      "description": "Queue a routine remediation ticket on the team's backlog.",
      "on_completion": "end--66666666-6666-4666-8666-666666666666"
    },
    "end--66666666-6666-4666-8666-666666666666": {
      "type": "end",
      "name": "intake-end"
    }
  },
  "x_secops_ng": {
    "stable_id": "playbook.vuln_intake@v1",
    "content_version": "0.1.0",
    "maturity": "draft",
    "compile_targets": ["n8n", "temporal", "langgraph"],
    "detection_refs": ["detection.sigma.vuln.cve_advisory_seen@v1"],
    "control_refs": ["control.nis2.art21.risk_management@v1"],
    "telemetry_refs": ["telemetry.ocsf.vulnerability_finding@v1"],
    "metric_refs": ["metric.mttr.vuln_critical@v1"],
    "sources": [
      "OASIS CACAO v2.0 specification",
      "ENISA threat landscape — vulnerability management"
    ]
  }
}
