{
  "type": "playbook",
  "spec_version": "cacao-2.0",
  "id": "playbook--7c1e2b3a-4d5f-4a8b-9c0d-1e2f3a4b5c6d",
  "name": "Threat intelligence ingest",
  "description": "Portable response for ingesting external cyber threat intelligence. Pulls an upstream STIX 2.1 / TAXII feed, normalises indicators into a canonical record (cross-references in mappings.yaml; the released OCSF v1.3.0 catalogue has no dedicated threat-intel ingest class), and propagates the result to detection (Sigma rule activation in the operator's SIEM, emitting OCSF Detection Finding class_uid 2004 on match) and blocking (perimeter / DNS / EDR blocklist) controls. CACAO v2 portable artifact; runtime is the operator's choice — n8n, Temporal, or LangGraph.",
  "playbook_types": [
    "detection",
    "prevention",
    "investigation"
  ],
  "created_by": "identity--5ec075c0-5ec0-475c-85ec-075c05ec075c",
  "created": "2026-05-29T00:00:00Z",
  "modified": "2026-05-29T00:00:00Z",
  "labels": [
    "threat-intelligence",
    "ioc",
    "ingest",
    "stix",
    "ocsf"
  ],
  "playbook_variables": {
    "__feed_url__": {
      "type": "uri",
      "description": "TAXII collection URL or STIX 2.1 bundle endpoint to poll. Credentials are injected at compile-target runtime (directive #6); never inline here.",
      "external": true
    },
    "__feed_id__": {
      "type": "string",
      "description": "Stable identifier of the upstream feed (e.g. an ENISA CSIRTs-network feed, a national CSIRT bulletin, or a community MISP instance).",
      "external": true
    },
    "__confidence_threshold__": {
      "type": "integer",
      "description": "Minimum confidence score (0-100) at which an indicator is propagated to blocking controls. Lower-confidence indicators are kept for detection only.",
      "external": true,
      "value": 70
    },
    "__indicator_count__": {
      "type": "integer",
      "description": "Number of indicators normalised from the upstream bundle. Feeds the telemetry-coverage KPI.",
      "external": false
    },
    "__high_confidence__": {
      "type": "boolean",
      "description": "Whether the normalised indicator clears __confidence_threshold__. Drives the blocking-vs-detection-only branch.",
      "external": false
    }
  },
  "workflow_start": "start--10000000-0000-4000-8000-000000000001",
  "workflow": {
    "start--10000000-0000-4000-8000-000000000001": {
      "type": "start",
      "name": "intake-start",
      "on_completion": "action--10000000-0000-4000-8000-000000000002"
    },
    "action--10000000-0000-4000-8000-000000000002": {
      "type": "action",
      "name": "pull upstream feed",
      "description": "Poll the configured TAXII collection or STIX 2.1 endpoint and capture the raw bundle. The endpoint is operator-supplied; the content model does not embed feed URLs.",
      "on_completion": "action--10000000-0000-4000-8000-000000000003",
      "in_args": [
        "__feed_url__",
        "__feed_id__"
      ],
      "x_secops_ng": {
        "control_refs": [
          "control.threat_intel.feed_ingest@v1"
        ],
        "telemetry_refs": [],
        "metric_refs": [
          "kpi.coverage_threat_intel_feed@v1"
        ]
      }
    },
    "action--10000000-0000-4000-8000-000000000003": {
      "type": "action",
      "name": "normalise STIX to OCSF",
      "description": "Map STIX 2.1 SDOs (Indicator, Malware, Threat-Actor) into the playbook's canonical normalised-indicator record. The released OCSF v1.3.0 catalogue does not contain a dedicated threat-intel ingest event class, so no OCSF class is asserted here on the consumed side (see mappings.yaml — ocsf section). Persist normalised records keyed by indicator value; deduplicate against records seen within the last 24 hours.",
      "on_completion": "if-condition--10000000-0000-4000-8000-000000000004",
      "out_args": [
        "__indicator_count__",
        "__high_confidence__"
      ],
      "x_secops_ng": {
        "control_refs": [
          "control.threat_intel.normalisation@v1"
        ],
        "telemetry_refs": []
      }
    },
    "if-condition--10000000-0000-4000-8000-000000000004": {
      "type": "if-condition",
      "name": "above confidence threshold?",
      "description": "Branch on __high_confidence__. High-confidence indicators are propagated to enforcement; lower-confidence indicators activate detection rules only.",
      "condition": "__high_confidence__",
      "on_true": "action--10000000-0000-4000-8000-000000000005",
      "on_false": "action--10000000-0000-4000-8000-000000000006"
    },
    "action--10000000-0000-4000-8000-000000000005": {
      "type": "action",
      "name": "propagate to blocklist",
      "description": "Push high-confidence indicators (IPs, domains, file hashes) to the operator's enforcement plane: perimeter firewall, DNS sinkhole, EDR allow/deny list. Records the propagation event so MTTR-to-block can be measured.",
      "on_completion": "action--10000000-0000-4000-8000-000000000006",
      "in_args": [
        "__indicator_count__"
      ],
      "x_secops_ng": {
        "control_refs": [
          "control.blocklist.propagation@v1"
        ],
        "telemetry_refs": [
          "telemetry.ocsf.detection_finding@v1"
        ],
        "metric_refs": [
          "kpi.mttr_blocklist_propagation@v1"
        ]
      }
    },
    "action--10000000-0000-4000-8000-000000000006": {
      "type": "action",
      "name": "activate detection rule",
      "description": "Activate or refresh the corresponding upstream Sigma rule(s) in the operator's SIEM so subsequent telemetry matching the indicator generates an alert. Sigma rule IDs are pinned to upstream SigmaHQ — the framework does not re-author rule bodies (see README for the upstream rule ID list).",
      "on_completion": "end--10000000-0000-4000-8000-000000000007",
      "x_secops_ng": {
        "control_refs": [
          "control.detection.sigma_deployment@v1"
        ],
        "telemetry_refs": [
          "telemetry.ocsf.detection_finding@v1"
        ],
        "metric_refs": [
          "kpi.mttd_threat_intel_indicator@v1"
        ]
      }
    },
    "end--10000000-0000-4000-8000-000000000007": {
      "type": "end",
      "name": "intake-end"
    }
  },
  "x_secops_ng": {
    "stable_id": "playbook.threat_intel_ingest@v1",
    "content_version": "0.1.0",
    "maturity": "experimental",
    "compile_targets": [
      "n8n",
      "temporal",
      "langgraph"
    ],
    "control_refs": [
      "control.threat_intel.feed_ingest@v1",
      "control.threat_intel.normalisation@v1",
      "control.blocklist.propagation@v1",
      "control.detection.sigma_deployment@v1"
    ],
    "telemetry_refs": [
      "telemetry.ocsf.detection_finding@v1"
    ],
    "metric_refs": [
      "kpi.mttd_threat_intel_indicator@v1",
      "kpi.mttr_blocklist_propagation@v1",
      "kpi.coverage_threat_intel_feed@v1"
    ],
    "sources": [
      "OASIS CACAO v2.0 specification — workflow step types, variable conventions, x_ extension namespace",
      "OASIS STIX 2.1 specification — Indicator, Malware, Threat-Actor SDOs consumed by the normalisation step",
      "OCSF v1.3.0 — Detection Finding (class_uid 2004) event class emitted on Sigma-rule match; see content/playbooks/threat_intel_ingest/mappings.yaml for the OCSF binding (no dedicated threat-intel ingest class exists in the released catalogue)",
      "SigmaHQ — upstream rule IDs referenced in the README (rule bodies remain upstream; this repo ships pointers only)",
      "ENISA — EU CSIRTs network operational guidance"
    ]
  }
}
